date,username,to,replies,retweets,favorites,text,geo,mentions,hashtags,id,permalink
2019-03-23 21:07:01,more_sneakers,,0,1,3,"AD : Last sizes online to get the Nike Wmns M2K Tekno 'Team Orange' JDSports:http://tidd.ly/2cb50f32 Offspring:http://tidd.ly/eae07c76 EU ONLY Footlocker EU UK:http://bit.ly/2IUOQbh DE:http://bit.ly/2GWDOQW Courir:http://tidd.ly/d4e9b03",,,,1109562214254608384,https://twitter.com/more_sneakers/status/1109562214254608384
2019-03-22 17:00:59,sneakermyth,,0,0,0,"ad: The Nike 'Black Leopard' Pack Has Just Dropped On ASOS, Full Size Runs! Air Max 1 &gt;&gt; http://bit.ly/2Ju06zN Air Max 95 &gt;&gt; http://bit.ly/2FvpQbb M2K Tekno &gt;&gt; http://bit.ly/2YfUsVp Air Force 1 Sage &gt;&gt; http://bit.ly/2FnYUZB",,,,1109137913332273153,https://twitter.com/sneakermyth/status/1109137913332273153
2019-03-22 10:30:06,ArchiveSA,,0,2,1,"Inspired by the Monarch franchise & taking us back to the early 2000s. The @nikesportswear M2K Tekno Women's sneaker features a textile upper that nods to the design of the original Monarch. Shop now in-store &amp;online @ArchiveSA: https://bit.ly/2HHIoXm #Nike #Archive",,@ArchiveSA,#Nike #Archive,1109039543645323265,https://twitter.com/ArchiveSA/status/1109039543645323265
2019-03-22 09:02:45,TableBayMall,,0,0,0,"Futuristic and stylish? Count us in! The Nike Sportswear M2K Tekno draws inspiration from the Monarch franchise and pushes it into today with a cutting edge clip and plush tongue. Get yours in-store at @sportsceneSA",,@sportsceneSA,,1109017561092501504,https://twitter.com/TableBayMall/status/1109017561092501504
2019-03-22 03:22:39,tokahontos_,,0,0,0,"I want those orange/blue & white Nike M2K Tekno’s soooo bad man and they only have size 12 &amp; 13 left in men’s 😩😩",,,,1108931969654480898,https://twitter.com/tokahontos_/status/1108931969654480898
2019-03-22 02:02:48,2SpiritRanch,,0,0,0,"Nike M2K TEKNO Shoes Sneakers - Pure Platinum/Black White (AV4789-004) Sz 9 http://rover.ebay.com/rover/1/711-53200-19255-0/1?ff3=2&amp;toolid=10039&amp;campid=5338245860&amp;item=233174557249&amp;vectorid=229466&amp;lgeo=1",,,,1108911877642424321,https://twitter.com/2SpiritRanch/status/1108911877642424321
2019-03-22 00:56:46,ModernOwners,,0,0,0,"New Nike Men's M2K TEKNO Running Sneakers Shoes - Midnight Navy(AV4789-401) http://rover.ebay.com/rover/1/711-53200-19255-0/1?ff3=2&amp;toolid=10039&amp;campid=5338247320&amp;item=163609399804&amp;vectorid=229466&amp;lgeo=1",,,,1108895257012420608,https://twitter.com/ModernOwners/status/1108895257012420608
2019-03-21 20:06:32,SoleInsider,,0,1,3,"Nike M2K Tekno purchase for $130.00 =&gt; http://bit.ly/2RZyaac",,,,1108822220464418817,https://twitter.com/SoleInsider/status/1108822220464418817
2019-03-21 19:16:27,athleboy,heylanka,0,0,0,"Nike - M2K Tekno , adidas Originals Yung-1 , Converse, air force 1 ...",,,,1108809615356149760,https://twitter.com/athleboy/status/1108809615356149760
2019-03-21 16:51:54,culatedesigns,,0,0,3,"Nike M2K Tekno Metallic Reflective Sneakers ❤👑❤ NOW IN STOCK 🛡 💈 Costs 24,000 Naira 🇳🇬 only 67 DOLLARS 💵 $Available in SIZES 40-45 💈 Comes with its Box 📦 and all Packages! DM or… https://www.instagram.com/p/BvRxjBxAD8A/?utm_source=ig_twitter_share&amp;igshid=1bceu9rblrblc",,,,1108773236450439168,https://twitter.com/culatedesigns/status/1108773236450439168
2019-03-21 14:57:22,culatedesigns,,0,0,0,"Nike M2K Tekno Metallic Reflective Sneakers ❤👑❤ NOW IN STOCK 🛡 💈 Costs 24,000 Naira 🇳🇬 only 67 DOLLARS 💵 $Available in SIZES 40-45 💈 Comes with its Box 📦 and all Packages! DM or… https://www.instagram.com/p/BvRkcYsAoYO/?utm_source=ig_twitter_share&amp;igshid=177nkjcwjvd5v",,,,1108744414464299008,https://twitter.com/culatedesigns/status/1108744414464299008
2019-03-21 14:01:18,culatedesigns,,0,0,0,"Nike M2K Tekno Metallic Reflective Sneakers ❤👑❤ NOW IN STOCK 🛡 💈 Costs 24,000 Naira 🇳🇬 only 67 DOLLARS 💵 $Available in SIZES 40-45 💈 Comes with its Box 📦 and all Packages! DM or… https://www.instagram.com/p/BvReBmlgN0W/?utm_source=ig_twitter_share&amp;igshid=1ol73mkos0msk",,,,1108730302829117440,https://twitter.com/culatedesigns/status/1108730302829117440
2019-03-21 01:26:58,ModernOwners,,0,0,0,"Nike M2K Tekno SP -CHOOSE SIZE- BV0074-200 Linen Monarch Wheat Ale Brown Flax QS ",,,,1108540470584578049,https://twitter.com/ModernOwners/status/1108540470584578049
2019-03-20 18:30:34,hypebae,,0,10,50,".@Nike's M2K Tekno arrives in a ""Plum Chalk/Plum Dust"" colorway. https://hypb.st/6urmh Photo: elevenstore",,@Nike,,1108435678327721984,https://twitter.com/hypebae/status/1108435678327721984
2019-03-20 15:23:01,KicksFinder,,1,8,57,"Ad: Nike M2K Tekno ""Atmosphere Grey"" is now available at Nikestore! &gt;&gt; http://bit.ly/2U4DGJS",,,,1108388482903359490,https://twitter.com/KicksFinder/status/1108388482903359490
2019-03-20 15:05:15,snkr_twitr,,0,1,3,"NEW: Nike M2K Tekno ‘Black/Cool Grey’ dropped with FREE SHIPPING via @nikestore http://bit.ly/2HtLkrb http://bit.ly/2HtLkrb #AD",,@nikestore,#AD,1108384009426362368,https://twitter.com/snkr_twitr/status/1108384009426362368
2019-03-20 04:19:22,snkr_twitr,,0,1,5,"NEW: Nike M2K Tekno ‘Black/Cool Grey’ dropped with FREE SHIPPING via @nikestore https://bit.ly/2HtLkrb https://bit.ly/2HtLkrb #AD",,@nikestore,#AD,1108221466900729856,https://twitter.com/snkr_twitr/status/1108221466900729856
2019-03-20 04:17:40,SOLELINKS,,0,5,28,"Ad: NEW Nike M2K Tekno 'Atmosphere Grey' dropped via Nike US =&gt; http://bit.ly/2UMskaq",,,,1108221040344199169,https://twitter.com/SOLELINKS/status/1108221040344199169
2019-03-20 01:48:17,punkintrillion,,0,0,0,"I’m fucked up bout Nike m2k tekno",,,,1108183448081125376,https://twitter.com/punkintrillion/status/1108183448081125376
2019-03-19 22:24:24,2SpiritRanch,,0,0,0,"NIKE LAB M2K TEKNO MENS SZ 10.5, JOHN ELLIOT, WAVE, WHITE BLACK TEAM ORANGE http://rover.ebay.com/rover/1/711-53200-19255-0/1?ff3=2&amp;toolid=10039&amp;campid=5338245860&amp;item=333123163840&amp;vectorid=229466&amp;lgeo=1",,,,1108132140233953282,https://twitter.com/2SpiritRanch/status/1108132140233953282
2019-03-19 20:27:08,ShoeShane3,,0,0,0,"New #MallWalkers on deck #Nike #M2K #Tekno #DadShoes #ShoeGame #KickstaGram #KOTD #WDYWT https://www.instagram.com/p/BvNAmEOHFqj/?utm_source=ig_twitter_share&amp;igshid=n4tldz0t7bwx",,,#MallWalkers #Nike #M2K #Tekno #DadShoes #ShoeGame #KickstaGram #KOTD #WDYWT,1108102627672379392,https://twitter.com/ShoeShane3/status/1108102627672379392
2019-03-19 16:06:33,SoleInsider,,0,0,0,"Nike M2K Tekno only $130.00 =&gt; http://bit.ly/2RZyaac",,,,1108037050824118274,https://twitter.com/SoleInsider/status/1108037050824118274
2019-03-19 16:00:37,TonyDiamondsTDC,,0,1,1,"Get Adidas Yung 96 for $57, Nike M2K Tekno from $62, Puma Suede from $37, Air Jordan 2 from $115 &amp; Asics Gel Lyte III from $40 in today’s deals https://buff.ly/2U2bQ0Q",,,,1108035556968148998,https://twitter.com/TonyDiamondsTDC/status/1108035556968148998
2019-03-19 15:59:45,StockXSneakers,,0,1,4,"The Nike M2K Tekno Phantom is available in dad-friendly sizes. Now you know! Get the kicks here: https://stockx.com/nike-m2k-tekno-phantom-olive-grey",,,,1108035335940947968,https://twitter.com/StockXSneakers/status/1108035335940947968
2019-03-19 10:22:46,more_sneakers,,0,0,0,"AD: Nike Wmns M2K Tekno 'Team Orange' available now on Snipes =&gt; http://tinyurl.com/y2xop8ca",,,,1107950533598416896,https://twitter.com/more_sneakers/status/1107950533598416896
2019-03-19 10:02:03,SneakerNews_82,,0,0,0,"Nike WMNS M2K Tekno Color: Obsidian Mist/Platinum Tint-White-Obsidian Mist Style Code: AO3108-400 Release Date: March 2019 Price: $100 http://bit.ly/2tmnWmd",,,,1107945318375542787,https://twitter.com/SneakerNews_82/status/1107945318375542787
2019-03-19 09:00:20,titoloshop,,0,0,0,"#sale #sale #sale 💥💥💥 Nike M2K Tekno - Black/Black-Off White-Obsidian P U R C H A S E ➡️ http://bit.ly/2IT3AeZ #nike #m2k #m2ktekno #black #white #obsidian #sale #sales #wintersale #sneakers #sneaker",,,#sale #sale #sale #nike #m2k #m2ktekno #black #white #obsidian #sale #sales #wintersale #sneakers #sneaker,1107929787488788481,https://twitter.com/titoloshop/status/1107929787488788481
2019-03-19 08:00:03,titoloshop,,0,0,1,"#sale #sale 💥💥 Nike M2K Tekno - Black/Black-Off White-Obsidian PURCHASE ➡️ http://bit.ly/2IT3AeZ #nike #m2k #m2ktekno #black #white #obsidian #sale #sales #wintersale #sneakers #sneaker",,,#sale #sale #nike #m2k #m2ktekno #black #white #obsidian #sale #sales #wintersale #sneakers #sneaker,1107914616255012864,https://twitter.com/titoloshop/status/1107914616255012864
2019-03-19 07:37:14,m88855771832,,0,0,0,"Nike M2K Tekno ‘Obsidian Mist’ Coming Soon https://ift.tt/2Y1mggh",,,,1107908874554798080,https://twitter.com/m88855771832/status/1107908874554798080
2019-03-19 07:34:52,sneakerfiles,,0,4,12,"Nike M2K Tekno ‘Obsidian Mist’ Coming Soon https://www.sneakerfiles.com/nike-m2k-tekno-obsidian-mist-ao3108-400-release-date/",,,,1107908279785553921,https://twitter.com/sneakerfiles/status/1107908279785553921
2019-03-19 07:30:17,titoloshop,,0,0,0,"#sale #sale 💥💥 Nike M2K Tekno - Black/Black-Off White-Obsidian get them now ➡️ http://bit.ly/2IT3AeZ #nike #m2k #m2ktekno #black #white #obsidian #sale #sales #wintersale #sneakers #sneaker",,,#sale #sale #nike #m2k #m2ktekno #black #white #obsidian #sale #sales #wintersale #sneakers #sneaker,1107907125349662720,https://twitter.com/titoloshop/status/1107907125349662720
2019-03-19 07:00:34,titoloshop,,0,0,0,"#sale #sale 💥💥 Nike Wmns M2K Tekno - Black/Black-White get them now 💫 http://bit.ly/1XsW72t #nike #wmns #m2k #m2ktekno #black #white #sale #sales #wintersale #sneakers #sneaker",,,#sale #sale #nike #wmns #m2k #m2ktekno #black #white #sale #sales #wintersale #sneakers #sneaker,1107899645907386373,https://twitter.com/titoloshop/status/1107899645907386373
2019-03-19 06:30:05,titoloshop,,0,0,0,"SALE! 💥💥 Nike Wmns M2K Tekno - Black/Black-White shop HERE 💫 http://bit.ly/1XsW72t #nike #wmns #m2k #m2ktekno #black #white #sale #sales #wintersale #sneakers #sneaker",,,#nike #wmns #m2k #m2ktekno #black #white #sale #sales #wintersale #sneakers #sneaker,1107891977683636226,https://twitter.com/titoloshop/status/1107891977683636226
2019-03-19 04:07:02,Quibellp,,0,0,0,"Nike M2K Tekno Gets Dressed in Striking ""Laser Fuchsia"" ",,,,1107855976743518208,https://twitter.com/Quibellp/status/1107855976743518208
2019-03-19 02:55:27,SneakersCartel,,0,0,0,"Obsidian Mist Covers This Women’s Colorway Of The Nike M2K Tekno https://www.sneakerscartel.com/obsidian-mist-covers-this-womens-colorway-of-the-nike-m2k-tekno/ #sneakers",,,#sneakers,1107837962924908544,https://twitter.com/SneakersCartel/status/1107837962924908544
2019-03-19 00:37:27,IcySoleOnline,,0,2,4,"45% OFF AD Nike M2K Tekno 'BLACK / WHITE' is now $55 (Retail $100). No code needed! BUY HERE: http://bit.ly/2CZQNVi",,,,1107803233232117761,https://twitter.com/IcySoleOnline/status/1107803233232117761
2019-03-18 22:21:07,ModernNotoriety,,1,1,21,"Nike WMNS M2K Tekno Color: Obsidian Mist/Platinum Tint-White-Obsidian Mist Style Code: AO3108-400 Release Date: March 2019 Price: $100 ",,,,1107768925675229195,https://twitter.com/ModernNotoriety/status/1107768925675229195
2019-03-18 22:00:11,titoloshop,,0,0,0,"SALE! 💥💥 Nike Wmns M2K Tekno - Black/Black-White get them now 💫 http://bit.ly/1XsW72t #nike #wmns #m2k #m2ktekno #black #white #sale #sales #wintersale #sneakers #sneaker",,,#nike #wmns #m2k #m2ktekno #black #white #sale #sales #wintersale #sneakers #sneaker,1107763656396324867,https://twitter.com/titoloshop/status/1107763656396324867
2019-03-18 21:15:33,kicksonfire,,0,4,12,"Obsidian Mist Covers This Women’s Colorway Of The Nike M2K Tekno - http://bit.ly/2Faqidp",,,,1107752423161036800,https://twitter.com/kicksonfire/status/1107752423161036800
2019-03-18 20:57:15,KICKFIXWORLWIDE,,0,0,0,"Obsidian Mist Covers This Women’s Colorway Of The Nike M2K Tekno https://ift.tt/2HFPDir #SNEAKERHEAD",,,#SNEAKERHEAD,1107747820256354304,https://twitter.com/KICKFIXWORLWIDE/status/1107747820256354304
2019-03-18 20:55:45,m88855771832,,0,0,0,"Obsidian Mist Covers This Women’s Colorway Of The Nike M2K Tekno https://ift.tt/2HFPDir",,,,1107747439832956928,https://twitter.com/m88855771832/status/1107747439832956928
2019-03-18 16:48:01,SBDetroit,,0,1,5,"Nike M2K Tekno Releasing in ""Obsidian Mist"" https://sneakerbardetroit.com/nike-m2k-tekno-obsidian-mist-ao3108-400-release-date/",,,,1107685096977559552,https://twitter.com/SBDetroit/status/1107685096977559552
2019-03-18 16:46:06,splurjj,,0,0,0,"Nike WMNS M2K Tekno “Plum Chalk” – PACKER ",,,,1107684614074785798,https://twitter.com/splurjj/status/1107684614074785798
2019-03-18 16:27:30,SneakersCartel,,0,0,0,"Nike M2K Tekno Releasing in “Obsidian Mist” https://www.sneakerscartel.com/nike-m2k-tekno-releasing-in-obsidian-mist/ #sneakers",,,#sneakers,1107679931507433472,https://twitter.com/SneakersCartel/status/1107679931507433472
2019-03-18 15:03:59,hypebae,,0,7,48,"Transition into spring with @Nike's new pastel blue M2K Tekno. ",,@Nike,,1107658915389550592,https://twitter.com/hypebae/status/1107658915389550592
2019-03-18 13:58:32,m88855771832,,0,0,0,"Nike M2K Tekno Releasing in “Obsidian Mist” https://ift.tt/2HFde2L",,,,1107642446769475584,https://twitter.com/m88855771832/status/1107642446769475584
2019-03-18 13:46:37,Kickz2fire,,0,0,0,"#SneakerBar Nike M2K Tekno Releasing in “Obsidian Mist” http://bit.ly/2YefC6u",,,#SneakerBar,1107639445073870848,https://twitter.com/Kickz2fire/status/1107639445073870848
2019-03-18 13:45:25,RT_Kicks4Sale,,0,0,0,"Nike M2K Tekno Releasing in “Obsidian Mist” http://bit.ly/2HsTiAP",,,,1107639144774356992,https://twitter.com/RT_Kicks4Sale/status/1107639144774356992
2019-03-18 13:16:07,more_sneakers,,0,0,0,"AD : Nike Wmns M2K Tekno 'Summit White/Hyper Jade/Black' Full restock under retail on LVR Use code APP15 Big sizes:http://bit.ly/2JjQnvX Small sizes:http://bit.ly/2W76dLU",,,,1107631770231541760,https://twitter.com/more_sneakers/status/1107631770231541760
2019-03-18 11:09:29,31BluePepper,,0,0,0,"Hoe gaaf is onze Original JoggPants met deze #nikem2ktekno sneakers! Sneakers don't make the JoggPants hot, but the right JoggPants can make a certain sneaker way better😉 #bluepepperindustries #jogglife kleur JoggPants #concrete",,,#nikem2ktekno #bluepepperindustries #jogglife #concrete,1107599903755255809,https://twitter.com/31BluePepper/status/1107599903755255809
2019-03-18 06:22:51,m88855771832,,0,0,0,"Nike M2K Tekno ‘Laser Fuchsia’ https://ift.tt/2Y4mUJR",,,,1107527767476895744,https://twitter.com/m88855771832/status/1107527767476895744
2019-03-18 06:16:14,sneakerfiles,,0,0,3,"Nike M2K Tekno ‘Laser Fuchsia’ https://www.sneakerfiles.com/nike-m2k-tekno-laser-fuchsia-av4221-600-release-date/",,,,1107526104842027009,https://twitter.com/sneakerfiles/status/1107526104842027009
2019-03-18 05:34:32,Gamii_GAmy,,0,0,0,"พร้อมส่ง adias falcon Risa Size 225 4UK Price : 3,290 FREE EMS Order : ID http://Rbn.store(มี@ด้วยค่ะ) #พรีออเดอร์ญี่ปุ่น #หิ้วเกาหลี #stylenandathailand #พรีออเดอร์เกาหลี #nikem2ktekno #supremethailand... https://www.facebook.com/175627135827736/posts/2221195274604235/",,,#stylenandathailand #nikem2ktekno #supremethailand,1107515610307670016,https://twitter.com/Gamii_GAmy/status/1107515610307670016
2019-03-17 18:56:25,sneak_seeker,,1,55,160,"Nike x M2K Tekno Custom - 📸 IG: staniflou - 🖍 IG: l.s_customs ",,,,1107355021757292544,https://twitter.com/sneak_seeker/status/1107355021757292544
2019-03-17 18:00:21,LIVESTOCKcanada,,0,0,3,"The Nike Women's M2K Tekno is now in stock at all of our shops and online | https://bit.ly/2QHzNFc",,,,1107340913112727553,https://twitter.com/LIVESTOCKcanada/status/1107340913112727553
2019-03-17 17:36:35,MagnusIsGreater,,0,0,0,"The Nike M2K Tekno Appears In A Cool “Obsidian Mist” ",,,,1107334929031946240,https://twitter.com/MagnusIsGreater/status/1107334929031946240
2019-03-17 17:19:05,KlubXclusive,,0,0,0,"The Nike M2K Tekno Appears In A Cool “Obsidian Mist” http://dlvr.it/R111SP",,,,1107330527529324545,https://twitter.com/KlubXclusive/status/1107330527529324545
2019-03-17 16:45:01,Hafare_,,0,0,0,"The Nike M2K Tekno is absolutely underrated, gonna cop soon for sure. Also ladies, get that instead of the FILA Disruptor 2",,,,1107321954921521153,https://twitter.com/Hafare_/status/1107321954921521153
2019-03-17 15:27:04,hypesrus,,0,0,0,"Nike M2K Tekno (White / White – Pure Platinum) https://shop.hypesrus.com/shop/nike-m2k-tekno-white-white-pure-platinum/?utm_source=dlvr.it&amp;utm_medium=twitter #sneaker #lpu",,,#sneaker #lpu,1107302337851228160,https://twitter.com/hypesrus/status/1107302337851228160
2019-03-16 22:08:17,ernestoaconnell,,0,0,0,"The Nike M2K Tekno Appears In A Cool “Obsidian Mist” ",,,,1107040918866198530,https://twitter.com/ernestoaconnell/status/1107040918866198530
2019-03-16 22:06:15,sneakersapp,,0,0,1,"The Nike M2K Tekno Appears In A Cool “Obsidian Mist” via #sneakersapp from https://snkrs.me/2FaqdGB",,,#sneakersapp,1107040406854873088,https://twitter.com/sneakersapp/status/1107040406854873088
2019-03-16 22:06:06,m88855771832,,0,0,0,"The Nike M2K Tekno Appears In A Cool “Obsidian Mist” https://ift.tt/2T7fWjy",,,,1107040370817404931,https://twitter.com/m88855771832/status/1107040370817404931
2019-03-16 22:02:36,RT_Kicks4Sale,,0,0,0,"The Nike M2K Tekno Appears In A Cool “Obsidian Mist” http://bit.ly/2HDquoE",,,,1107039489984073729,https://twitter.com/RT_Kicks4Sale/status/1107039489984073729
2019-03-16 15:00:49,KicksDealsCA,,0,2,5,"Super wild new colourway of the women's Nike M2K Tekno in ""Laser Fuschia"" for $140 with free shipping. https://bit.ly/2F6GYT8",,,,1106933345102036992,https://twitter.com/KicksDealsCA/status/1106933345102036992
2019-03-16 12:14:48,ShopAncel,,0,0,0,"Nike M2K TEKNO N21,000 discount price Nationwide delivery Available Send a Dm To place an order https://www.instagram.com/p/BvEZ3coFsmq/?utm_source=ig_twitter_share&amp;igshid=msklzxn647nd",,,,1106891564112973825,https://twitter.com/ShopAncel/status/1106891564112973825
2019-03-16 12:13:03,Luxury2Factory,,0,0,0,"Nike M2K TEKNO sneaker. . size36-44 . #nikem2k #nikem2ktekno #m2ktekno #m2k #kicksonfire #peepmysneaks #nike #kickstagram #sneakers #flykicks #igsneakercommunity #sneakerfreak… https://www.instagram.com/catchingig/p/BvEZqkRF3kq/?utm_source=ig_twitter_share&amp;igshid=nae0elql5xxe",,,#nikem2k #nikem2ktekno #m2ktekno #m2k #kicksonfire #peepmysneaks #nike #kickstagram #sneakers #flykicks #igsneakercommunity #sneakerfreak,1106891123987869696,https://twitter.com/Luxury2Factory/status/1106891123987869696
2019-03-15 22:28:06,iskamorena1,,0,0,0,"Nike's M2K Tekno Arrives in a Luxury ""Denim White/Hyper Crimson"" ",,,,1106683516694216707,https://twitter.com/iskamorena1/status/1106683516694216707
2019-03-15 22:01:32,kickslounge,,0,0,1,"The dad shoe trend is here to stay. The @Nike M2K Tekno Sneaker available at all Kicks Lounge locations for both men and women. @Akron, Ohio https://www.instagram.com/p/BvC4N_VnC6Y/?utm_source=ig_twitter_share&amp;igshid=fqczck8kjfn",,@Nike,,1106676831325962240,https://twitter.com/kickslounge/status/1106676831325962240
2019-03-15 22:00:22,TheSoleWomens,,0,0,2,"‘Laser Fuchsia’ Turns Nike’s M2K Tekno Purple See more: https://buff.ly/2u6FPWH",,,,1106676540287451137,https://twitter.com/TheSoleWomens/status/1106676540287451137
2019-03-15 12:05:31,hypebae,,0,5,19,"Would you cop or drop @Nike's latest M2K Tekno? https://hypebae.com/2019/3/nike-m2k-tekno-denim-white-hyper-crimson?utm_source=twitter&amp;utm_medium=social&amp;utm_campaign=twitter_post",,@Nike,,1106526839827247107,https://twitter.com/hypebae/status/1106526839827247107
2019-03-15 02:24:52,1paulajose,,0,0,0,"the nike m2k tekno looks so fine tho",,,,1106380714935631872,https://twitter.com/1paulajose/status/1106380714935631872
2019-03-14 22:12:41,JTKNotify,,0,0,0,"Nike Women's M2K Tekno / Summit White https://www.deadstock.ca/products/nike-womens-m2k-tekno-summit-white",,,,1106317249722417152,https://twitter.com/JTKNotify/status/1106317249722417152
2019-03-14 18:30:00,IcySoleOnline,,0,4,4,"NEW RELEASE AD Womens Nike M2K Tekno LX 'OXYGEN PURPLE' are now available BUY HERE: http://bit.ly/2Hm23fO",,,,1106261209697783808,https://twitter.com/IcySoleOnline/status/1106261209697783808
2019-03-14 18:20:40,MarioGoetze,,29,70,1197,"What’s your favorite @nike shoe?Mine is M2K Tekno ✔️ ",,@Nike,,1106258861919485954,https://twitter.com/MarioGoetze/status/1106258861919485954
2019-03-14 17:48:21,IcySoleOnline,,0,3,2,"NEW RELEASE AD Womens Nike M2K Tekno LX 'TEAL TINT' are now available BUY HERE: http://bit.ly/2XX99wA",,,,1106250727284973571,https://twitter.com/IcySoleOnline/status/1106250727284973571
2019-03-14 15:31:35,WestCoastSoles,,0,0,0,"$75 Women's Nike M2K Tekno Discount in cart. http://bit.ly/2JmtaJs",,,,1106216308960485376,https://twitter.com/WestCoastSoles/status/1106216308960485376
2019-03-14 15:00:25,TheSoleWomens,,0,0,1,"‘Laser Fuchsia’ Turns Nike’s M2K Tekno Purple See more: https://buff.ly/2u6FPWH",,,,1106208466891350016,https://twitter.com/TheSoleWomens/status/1106208466891350016
2019-03-14 08:05:00,NotSnkrs,,0,0,0,"Nike Reveal M2K Tekno ‘Laser Fuchsia’ ",,,,1106103925390929920,https://twitter.com/NotSnkrs/status/1106103925390929920
2019-03-14 03:17:32,ModernOwners,,0,0,0,"Authentic Nike M2K Tekno Gunsmoke Premium Shoes BV2519-001 NSW Men's Size 13 http://rover.ebay.com/rover/1/711-53200-19255-0/1?ff3=2&amp;toolid=10039&amp;campid=5338247320&amp;item=264238334774&amp;vectorid=229466&amp;lgeo=1",,,,1106031579992936448,https://twitter.com/ModernOwners/status/1106031579992936448
2019-03-13 21:15:50,more_sneakers,,0,0,1,"AD: RESTOCK Nike M2K Tekno 'Team Orange' on Footasylum with 10% OFF Use code MAR19 Men:http://tidd.ly/b27a4b15 Wmns:http://tidd.ly/49c5c1dd",,,,1105940556511961088,https://twitter.com/more_sneakers/status/1105940556511961088
2019-03-13 20:06:38,SoleInsider,,0,0,1,"Nike M2K Tekno only $130.00 =&gt; http://bit.ly/2RZyaac",,,,1105923139505131520,https://twitter.com/SoleInsider/status/1105923139505131520
2019-03-13 18:15:05,titoloshop,,0,0,0,"PRICE DROP 🔥🔥🔥 Nike M2K Tekno SP - Atmosphere Grey/Gunsmoke-Dark Grey-White check ➡️ http://bit.ly/2IT3AeZ #jordan #bhm #airjordan #adidas #nike #puma #reebok #sale #sales #wintersale #salestyle #sneakers #sneaker",,,#jordan #bhm #bhm #airjordan #adidas #nike #puma #reebok #sale #sales #wintersale #salestyle #sneakers #sneaker,1105895069985447937,https://twitter.com/titoloshop/status/1105895069985447937
2019-03-13 17:45:10,titoloshop,,0,0,0,"PRICE DROP 🔥🔥🔥 Nike M2K Tekno SP - Atmosphere Grey/Gunsmoke-Dark Grey-White link ➡️ http://bit.ly/2IT3AeZ #jordan #bhm #airjordan #adidas #nike #puma #reebok #sale #sales #wintersale #salestyle #sneakers #sneaker",,,#jordan #bhm #bhm #airjordan #adidas #nike #puma #reebok #sale #sales #wintersale #salestyle #sneakers #sneaker,1105887540131840001,https://twitter.com/titoloshop/status/1105887540131840001
2019-03-13 17:15:03,titoloshop,,0,0,0,"PRICE DROP 🔥🔥🔥 Nike M2K Tekno SP - Atmosphere Grey/Gunsmoke-Dark Grey-White shop now ➡️ http://bit.ly/2IT3AeZ #jordan #bhm #airjordan #adidas #nike #puma #reebok #sale #sales #wintersale #salestyle #sneakers #sneaker",,,#jordan #bhm #bhm #airjordan #adidas #nike #puma #reebok #sale #sales #wintersale #salestyle #sneakers #sneaker,1105879959468417024,https://twitter.com/titoloshop/status/1105879959468417024
2019-03-13 14:00:57,endclothing,,0,1,28,"The Nike M2K Tekno in blue animal print is now available online (£119) -- http://end.global/7pi",,,,1105831112289542144,https://twitter.com/endclothing/status/1105831112289542144
2019-03-13 06:06:38,SoleInsider,,0,0,1,"Nike M2K Tekno buy for $130.00 =&gt; http://bit.ly/2RZyaac",,,,1105711747929907202,https://twitter.com/SoleInsider/status/1105711747929907202
2019-03-13 02:06:30,TheMotherLoving,,0,0,0,"New #MomShoe FTW!!! #themotherlovinglife #themotherlovingpodcast Nike's M2K Tekno ""Laser Fuchsia"" Is the Perfect Spring Sneaker ",,,#MomShoe #themotherlovinglife #themotherlovingpodcast,1105651315877785605,https://twitter.com/TheMotherLoving/status/1105651315877785605
2019-03-13 01:21:37,SBDetroit,,0,2,3,"Nike M2K Tekno in ""Laser Fuchsia"" https://sneakerbardetroit.com/nike-m2k-tekno-laser-fuchsia-av4221-600-release-date/",,,,1105640021309247489,https://twitter.com/SBDetroit/status/1105640021309247489
2019-03-12 23:47:25,SneakersCartel,,0,0,0,"Nike M2K Tekno Gets Dressed in Striking ""Laser Fuchsia"" https://www.sneakerscartel.com/nike-m2k-tekno-gets-dressed-in-striking-laser-fuchsia/ #sneakers",,,#sneakers,1105616316973473792,https://twitter.com/SneakersCartel/status/1105616316973473792
2019-03-12 23:08:06,SneakersCartel,,0,0,0,"Official Images: Nike M2K Tekno SE Laser Fuchsia https://www.sneakerscartel.com/official-images-nike-m2k-tekno-se-laser-fuchsia/ #sneakers",,,#sneakers,1105606419573690368,https://twitter.com/SneakersCartel/status/1105606419573690368
2019-03-12 22:23:38,2SpiritRanch,,0,0,0,"NIKE LAB M2K TEKNO MENS SZ 10.5, JOHN ELLIOT, WAVE, WHITE BLACK TEAM ORANGE http://rover.ebay.com/rover/1/711-53200-19255-0/1?ff3=2&amp;toolid=10039&amp;campid=5338245860&amp;item=333113337769&amp;vectorid=229466&amp;lgeo=1",,,,1105595230160605185,https://twitter.com/2SpiritRanch/status/1105595230160605185
