date,username,to,replies,retweets,favorites,text,geo,mentions,hashtags,id,permalink
2019-02-27 21:56:56,selfcar43274064,,1,0,0,"Nike air Max full ride TR 1.5 Nike tanjun ",,,,1100877467215106060,https://twitter.com/selfcar43274064/status/1100877467215106060
2019-02-27 11:31:24,menslife247,,0,0,0,"Wearing my Nike Tanjun 👟 ",,,,1100720047583051777,https://twitter.com/menslife247/status/1100720047583051777
2019-02-27 10:57:47,thechellehodge,xyessiexg,1,0,0,"I ended up buying the Nike Tanjun with the white bottom. I’m going to end up cleaning them daily though. I hate when they look grimy. I have bought from torrid before. Their shoe quality is not good for the money they charge.",,,,1100711589181833216,https://twitter.com/thechellehodge/status/1100711589181833216
2019-02-27 01:57:55,Bree70158509,,0,0,0,"Check out what I just added to my closet on Poshmark: Nike tanjun racer. https://poshmark.com/listing/5c748bb23e0caaf7cbbbb0dd?utm_campaign=referral_code%3DLOWEBD&amp;utm_content=feature%3Dsh_li_el_ios%26rfuid%3D5ac95a565929190c7f53d929%26ext_trk%3Dbranch&amp;utm_source=tw_sh via @poshmarkapp #shopmycloset",,@Poshmarkapp,#shopmycloset,1100575724711292929,https://twitter.com/Bree70158509/status/1100575724711292929
2019-02-26 21:28:25,MissBargainHunt,,0,0,0,"Check out what I just added to my closet on Poshmark: Nike Air Kids Black JJ2 Tanjun Sneakers 1 Year. https://poshmark.com/listing/5c75af7434e48abcc4dc45f0?utm_campaign=referral_code%3DMISSBARGAINHUNT&amp;utm_content=feature%3Dsh_li_cl_web%26rfuid%3D5290d6b1fb666a197e017d40%26ext_trk%3Dbranch&amp;utm_source=tw_sh via @poshmarkapp #shopmycloset",,@Poshmarkapp,#shopmycloset,1100507905000755201,https://twitter.com/MissBargainHunt/status/1100507905000755201
2019-02-26 12:38:18,lift_and_thrift,,0,0,0,"Check out NEW Nike Tanjun Racer Shoes Womens Pink Athletic Running AH5247-001 Size 7.5 https://www.ebay.com/ulk/itm/323709010631 @eBay",,@eBay,,1100374494403837952,https://twitter.com/lift_and_thrift/status/1100374494403837952
2019-02-26 12:04:08,Chelzyjay,,0,0,0,"#Shop jokbim_kiddies • • • • • 💙💙💙💙 Nike Tanjun Breathable Lightweight Sports Sneakers 💙💙💙💙 #casual #comfortable * * Great Quality. Unbeatable Price👍 Brand: Nike Colour:… https://www.instagram.com/p/BuWCVjQnaUU/?utm_source=ig_twitter_share&amp;igshid=1dtkkhk8orpqw",,,#Shop #casual #comfortable,1100365897372454913,https://twitter.com/Chelzyjay/status/1100365897372454913
2019-02-26 07:00:03,JustBlingItinc,,0,0,0,"Girls Nike Tanjun Blinged Out With Swarovski Crystals - Triple Black - Big Kids #blingbling #crystal http://www.justblingitinc.com/148-girls-nike-tanjun-crystals-triple-black-big-kids.html",,,#blingbling #crystal,1100289373222793216,https://twitter.com/JustBlingItinc/status/1100289373222793216
2019-02-26 05:17:13,BettyBe82947934,,0,0,0,"WMNS NIKE TANJUN Size for Women 6US / 36.5 / 23 cm 7US / 38 / 24 cm 8US / 39 / 25 cm 🔖3150 ส่งฟรี ems ",,,,1100263493859606528,https://twitter.com/BettyBe82947934/status/1100263493859606528
2019-02-26 02:55:47,lift_and_thrift,,0,0,0,"Check out NEW Nike Tanjun Racer Shoes Womens Pink Athletic Running AH5247-001 Size W7 https://www.ebay.com/ulk/itm/323707610678 @eBay",,@eBay,,1100227901331517440,https://twitter.com/lift_and_thrift/status/1100227901331517440
2019-02-26 02:09:40,GiftedAsia,LandoSoReal,1,3,15,"I’m gonna stick right to my Nike Tanjun sandals. The consecutive Filas pattern is so tacky ",,,,1100216296975810567,https://twitter.com/GiftedAsia/status/1100216296975810567
2019-02-26 00:47:47,Bree70158509,,0,0,0,"Check out what I just added to my closet on Poshmark: Nike tanjun racer. https://poshmark.com/listing/5c748bb23e0caaf7cbbbb0dd?utm_campaign=referral_code%3DLOWEBD&amp;utm_content=feature%3Dsh_li_cl_ios%26rfuid%3D5ac95a565929190c7f53d929%26ext_trk%3Dbranch&amp;utm_source=tw_sh via @poshmarkapp #shopmycloset",,@Poshmarkapp,#shopmycloset,1100195688330055680,https://twitter.com/Bree70158509/status/1100195688330055680
2019-02-25 10:52:07,NikeonEbayUS,,0,0,0,"NEW ON EBAY US! MEN'S NIKE Tanjun Shoes Triple Black Casual Trainers Roshe size 12 (812654 001) https://ift.tt/2EwNKT9",,,,1099985385999032320,https://twitter.com/NikeonEbayUS/status/1099985385999032320
2019-02-25 08:22:13,NikeonEbayUS,,0,0,0,"NEW ON EBAY US! MEN'S NIKE Tanjun Shoes Triple Black Casual Trainers Roshe size 12 (812654 001) https://ift.tt/2EwNKT9",,,,1099947662655320064,https://twitter.com/NikeonEbayUS/status/1099947662655320064
2019-02-24 18:31:00,ohnanette,,0,0,0,"I bought the Nike Tanjun sandals, and I fucking love them",,,,1099738479263735808,https://twitter.com/ohnanette/status/1099738479263735808
2019-02-24 14:06:42,ToxicBeautyBlog,,0,0,0,"Check out what I just added to my closet on Poshmark: Nike Tanjun Running Shoes Mens Black. https://poshmark.com/listing/5c2184cac89e1d61fda6f4b3?utm_campaign=referral_code%3DPOSHROB6&amp;utm_content=feature%3Dsh_li_el_ios%26rfuid%3D58eac08d17535c59ac42472c%26ext_trk%3Dbranch&amp;utm_source=tw_sh via @poshmarkapp #shopmycloset",,@Poshmarkapp,#shopmycloset,1099671967064440833,https://twitter.com/ToxicBeautyBlog/status/1099671967064440833
2019-02-23 20:24:00,thechellehodge,,1,0,0,"@Nike Can you please, for the love of god, make a black on black sneaker for a wide foot??? The Tanjun is a perfect fit for me and I just want it with a black bottom and not white. Why can’t we make this happen?? Take my money and help me out!",,@Nike,,1099404529873891328,https://twitter.com/thechellehodge/status/1099404529873891328
2019-02-23 14:01:49,lift_and_thrift,,0,0,0,"Check out NEW Nike Tanjun Racer Shoes Womens Pink Athletic Running AH5247-001 Size W7.5/6Y https://www.ebay.com/ulk/itm/323665140739 @eBay",,@eBay,,1099308349697548288,https://twitter.com/lift_and_thrift/status/1099308349697548288
2019-02-23 13:57:30,lift_and_thrift,,0,0,0,"Check out NEW Nike Tanjun Racer Shoes Womens Pink Athletic Running AH5247-001 Size W7/5.5Y https://www.ebay.com/ulk/itm/323664777750 @eBay",,@eBay,,1099307261766307840,https://twitter.com/lift_and_thrift/status/1099307261766307840
2019-02-23 06:05:08,BoutiqueSneaker,,0,0,0,"Nike Tanjun, Baskets Homme https://www.thesneakerboutique.com/produit/nike-tanjun-baskets-homme/",,,,1099188388849020928,https://twitter.com/BoutiqueSneaker/status/1099188388849020928
2019-02-23 05:39:52,29footwear,,0,0,0,"NIKE TANJUN PEACH SILVER ORIGINAL MADE IN INDONESIA via @bukalapak https://www.bukalapak.com/p/fashion-pria/sepatu-169/sneaker/18j9et1-jual-nike-tanjun-peach-silver-original-made-in-indonesia?utm_source=apps",,@bukalapak,,1099182029696950272,https://twitter.com/29footwear/status/1099182029696950272
2019-02-23 00:36:53,Lindsey_Gayle40,,0,0,0,"I seen some gold tanjun Nike slides today. But I neede a size up and they didn’t have them. They also said beige on the box. A lie. That’s gold honey.",,,,1099105784024186880,https://twitter.com/Lindsey_Gayle40/status/1099105784024186880
2019-02-22 21:43:30,NikeonEbayUS,,0,0,0,"NEW ON EBAY US! Nike Men Tanjun SE Black/Gym Red/White Running Shoe AR1941-003 O21119 BNIB! https://ift.tt/2IvCqe4",,,,1099062150780329985,https://twitter.com/NikeonEbayUS/status/1099062150780329985
2019-02-22 20:29:40,Prenzi,,0,0,0,"Nike - Tanjun SE (Black/Solar Red/Pure Platinum/Sail) SKU: #8709415 683041 - http://tinyurl.com/y5h3vbr3 @Prenzi",,@Prenzi,,1099043569262833664,https://twitter.com/Prenzi/status/1099043569262833664
2019-02-22 19:53:35,Jrd117,,0,0,0,"NEW! Nike Adult Womens Tanjun SE Swoosh Lightweight Shoe Training Grey... - https://buyaussiestuff.com/new-nike-adult-womens-tanjun-se-swoosh-lightweight-shoe-training-grey/ Ad",,,,1099034489374699520,https://twitter.com/Jrd117/status/1099034489374699520
2019-02-22 18:33:11,Brare_nyc,,0,2,0,"Check out what I just added to my closet on Poshmark: NIKE TANJUN HIGH RISE Black boots. https://poshmark.com/listing/5c3180b4534ef9471f61c08a?utm_campaign=referral_code%3DBRARE&amp;utm_content=feature%3Dsh_li__and%26rfuid%3D562fd3286d9a13cc4928b531%26ext_trk%3Dbranch&amp;utm_source=tw_sh via @poshmarkapp #shopmycloset",,@Poshmarkapp,#shopmycloset,1099014251887259648,https://twitter.com/Brare_nyc/status/1099014251887259648
2019-02-22 16:18:04,lift_and_thrift,,0,0,0,"Check out NEW Nike Tanjun Racer Shoes Womens Pink Athletic Running AH5247-001 Size W7/5.5Y https://www.ebay.com/ulk/itm/323664777750 @eBay",,@eBay,,1098980252158709762,https://twitter.com/lift_and_thrift/status/1098980252158709762
2019-02-22 08:03:38,NikeonEbayUS,,0,0,0,"NEW ON EBAY US! NEW Nike Tanjun Men's Shoes TRIPLE BLACK Casual Trainers Roshe 812654-001 https://ift.tt/2SitNmL",,,,1098855820668928000,https://twitter.com/NikeonEbayUS/status/1098855820668928000
2019-02-22 07:40:39,serene350,,1,2,1,"Pic 1: 9k Pic 2: 8k Pic 3: 15k(Original Nike Tanjun Run) Pic 4: 8k Delivery within Lagos : 1k Delivery to other states : 2k Whatsapp https://api.whatsapp.com/send?phone=2348055261140 now for order Instagram : t.h.e_m.i.n.a",,,,1098850038468562945,https://twitter.com/serene350/status/1098850038468562945
2019-02-21 17:18:14,CarloRossiSippn,,0,0,1,"@Nike may be receiving punishment all for not providing men with a tanjun sandal . ⚡️📡 #GodSquad",,@Nike,#GodSquad,1098633002605674496,https://twitter.com/CarloRossiSippn/status/1098633002605674496
2019-02-21 08:42:15,robinsnewswire,,0,0,0,"""Nike Men's Tanjun Premium Casual Sneakers from Finish Line only $25.00: eDeal Info"" #Amazon #Discounts: https://www.robinspost.com/shopping/daily-specials/48087-nike-men-s-tanjun-premium-casual-sneakers-from-finish-line-only-25-00-edeal-info.html",,,#Amazon #Discounts,1098503152800694274,https://twitter.com/robinsnewswire/status/1098503152800694274
2019-02-21 08:15:20,eDealinfoUSA,,0,0,0,"Nike Men's Tanjun Premium Casual Sneakers from Finish Line only $25.00 https://goo.gl/fb/Pje22S",,,,1098496377041104897,https://twitter.com/eDealinfoUSA/status/1098496377041104897
2019-02-20 21:44:38,abigdogmom_,,0,0,0,"I just discovered this on Poshmark: Women's Nike tanjun shoes customized swarvoski. https://posh.mk/u4rLWMCitU via @poshmarkapp",,@Poshmarkapp,,1098337658579898374,https://twitter.com/abigdogmom_/status/1098337658579898374
2019-02-20 18:47:19,pimpamcreations,,0,3,9,"This is my special tribute to @ValeYellow46 🤘💪on Nike Tanjun :) ",,@ValeYellow46,,1098293034117144576,https://twitter.com/pimpamcreations/status/1098293034117144576
2019-02-20 18:24:33,lift_and_thrift,,0,0,0,"Check out NEW Nike Tanjun Racer Shoes Womens Pink Athletic Running AH5247-001 Size W7.5/6Y https://www.ebay.com/ulk/itm/323665140739 @eBay",,@eBay,,1098287307046744064,https://twitter.com/lift_and_thrift/status/1098287307046744064
2019-02-20 18:23:05,lift_and_thrift,,0,0,0,"Check out NEW Nike Tanjun Racer Shoes Womens Pink Athletic Running AH5247-001 Size W7/5.5Y https://www.ebay.com/ulk/itm/323664777750 @eBay",,@eBay,,1098286935339081728,https://twitter.com/lift_and_thrift/status/1098286935339081728
2019-02-20 15:45:20,jrsashar,,0,0,0,"Check out Boys Nike Black Tanjun Shoes Sz 1.5 #Nike https://ebay.us/A85J7t via @eBay",,@eBay,#Nike,1098247235702280192,https://twitter.com/jrsashar/status/1098247235702280192
2019-02-20 13:25:00,collabsstorejkt,,0,0,0,"*RESTOCK* NIKE TANJUN RUN BLACK WHITE Size : 37 38 39 40 41 42 43 44 (Incld Half Size) Sale Price : Rp 350.000 Condition : Brand New Replace Box (BNWB) Order… https://www.instagram.com/p/BuGu0mIFuj_B-zoHTeqDGVPuKV1fHwb6B506zE0/?utm_source=ig_twitter_share&amp;igshid=733npcs78zdo",,,,1098211919574446080,https://twitter.com/collabsstorejkt/status/1098211919574446080
2019-02-20 09:37:22,runningwatches2,,0,0,1,"Cheap NIKE Womens Tanjun ENG Shoes Pink Pearl Pink Sunset Glow Size 6.5 https://runninggear.info/cheap-nike-womens-tanjun-eng-shoes-pink-pearl-pink-sunset-glow-size-6-5/",,,,1098154636870062080,https://twitter.com/runningwatches2/status/1098154636870062080
2019-02-20 08:26:18,74sneakers,,0,0,0,"Nike Tanjun Black White Size : 36 EUR - 44 EUR Price : Rp, 300,000. For order please contact us via whatsapp or text message 081218648834 Line Account : @74sneakers ( use @)… https://www.instagram.com/p/BuGMo0WBC1Q/?utm_source=ig_twitter_share&amp;igshid=136nfpae7lmoh",,@74sneakers,,1098136752857010176,https://twitter.com/74sneakers/status/1098136752857010176
2019-02-20 00:00:05,JustBlingItinc,,0,0,0,"Girls Nike Tanjun Blinged Out With Swarovski Crystals - Triple Black - Big Kids #blingbling #crystal http://www.justblingitinc.com/148-girls-nike-tanjun-crystals-triple-black-big-kids.html",,,#blingbling #crystal,1098009357986422784,https://twitter.com/JustBlingItinc/status/1098009357986422784
2019-02-19 22:56:26,cyberpeach22,,0,0,0,"Onhand Nike tanjun racer Legit Brandnew Size.7.5",,,,1097993338551189505,https://twitter.com/cyberpeach22/status/1097993338551189505
2019-02-19 11:32:06,Jrd117,,0,0,0,"NEW! Nike Adult Womens Tanjun Black Swoosh Lightweight Shoe Training... - https://buyaussiestuff.com/new-nike-adult-womens-tanjun-black-swoosh-lightweight-shoe-training/ Ad",,,,1097821120789569542,https://twitter.com/Jrd117/status/1097821120789569542
2019-02-19 06:50:02,JustBlingItinc,,0,0,0,"Nike Tanjun Racer Blinged Out With Swarovski Crystals - Black/Green #blingbling #crystal http://www.justblingitinc.com/22-nike-tanjun-racer-crystals-black-green.html",,,#blingbling #crystal,1097750136942297089,https://twitter.com/JustBlingItinc/status/1097750136942297089
2019-02-18 23:09:29,shopondiscount,,0,0,0,"Nike Tanjun Print Trainers Girls &gt;&gt;&gt;http://fave.co/2G12bR0 NOW £11:00 WAS £29.99 Colour GREY OR PINK /Cheetah",,,,1097634235698110464,https://twitter.com/shopondiscount/status/1097634235698110464
2019-02-18 19:27:53,Jrd117,,0,0,0,"NEW! NIKE MENS TANJUN SWOOSH LIGHTWEIGHT RUN TRAINING CASUAL SHOE... - https://buyaussiestuff.com/new-nike-mens-tanjun-swoosh-lightweight-run-training-casual-shoe/ Ad",,,,1097578469335003136,https://twitter.com/Jrd117/status/1097578469335003136
2019-02-18 18:18:38,ijurisc,,0,0,0,"Check out Nike Tanjun SE Sports Shoes Sneakers Trainers - All Colors And Sizes #Nike #RunningShoes https://ebay.us/zN6ml7 via @eBay",,@eBay,#Nike #RunningShoes,1097561041872056324,https://twitter.com/ijurisc/status/1097561041872056324
2019-02-18 18:15:00,Benzinga,,0,1,0,"Nike's 'Tanjun' Was The Bestselling Shoe Of 2018; Mid-Market Footwear Dominates Top 10 $ADDYY $NKE $VFC",,,,1097560125945065472,https://twitter.com/Benzinga/status/1097560125945065472
2019-02-18 11:49:50,74sneakers,,0,0,0,"Nike Tanjun Olive Black Size : 39 EUR - 42 EUR Price : Rp. 450,000. For order please contact us via whatsapp or text message 081218648834 Line Account : @74sneakers ( use @)… https://www.instagram.com/p/BuBaVt9BHZU/?utm_source=ig_twitter_share&amp;igshid=zi99t0a2zwf7",,@74sneakers,,1097463194186964992,https://twitter.com/74sneakers/status/1097463194186964992
2019-02-18 00:57:11,PersnicketysC,,0,1,1,"Check out what I just added to my closet on Poshmark: Nike | Tanjun Sneakers, Youth Size 2. https://poshmark.com/listing/5c50d1c17386bc86c5b00fe1?utm_campaign=referral_code%3DMEGANOCCELLI&amp;utm_content=feature%3Dsh_li_el_ios%26rfuid%3D5ad27a72f76cca136330868f%26ext_trk%3Dbranch&amp;utm_source=tw_sh via @poshmarkapp #shopmycloset",,@Poshmarkapp,#shopmycloset,1097298950929805313,https://twitter.com/PersnicketysC/status/1097298950929805313
2019-02-17 02:09:33,ToxicBeautyBlog,,0,0,0,"Check out what I just added to my closet on Poshmark: Nike Tanjun Running Shoes Mens Black. https://poshmark.com/listing/5c2184cac89e1d61fda6f4b3?utm_campaign=referral_code%3DPOSHROB6&amp;utm_content=feature%3Dsh_li_el_ios%26rfuid%3D58eac08d17535c59ac42472c%26ext_trk%3Dbranch&amp;utm_source=tw_sh via @poshmarkapp #shopmycloset",,@Poshmarkapp,#shopmycloset,1096954775466209281,https://twitter.com/ToxicBeautyBlog/status/1096954775466209281
2019-02-16 17:13:20,TheShoeShop2,,0,0,0,"Nike Men’s Tanjun Running Shoes, (White/Black 101), 10 UK http://www.theshoesshop.co.uk/nike-mens-tanjun-running-shoes-white-black-101-10-uk/",,,,1096819832908070913,https://twitter.com/TheShoeShop2/status/1096819832908070913
2019-02-16 11:50:47,BoutiqueSneaker,,0,0,0,"Nike Tanjun, Baskets Homme https://www.thesneakerboutique.com/produit/nike-tanjun-baskets-homme/",,,,1096738658751860742,https://twitter.com/BoutiqueSneaker/status/1096738658751860742
2019-02-15 18:56:44,ssbachtiar,,0,0,0,"Selling Nike tanjun grey print white Rp 355,000 https://carousell.com/p/215026981 #carousell @carousell_id",,@carousell_id,#carousell,1096483465896157184,https://twitter.com/ssbachtiar/status/1096483465896157184
2019-02-15 14:36:15,shobur_pavel,,0,0,0,"🔥Ready Stock🔥 Nike Rise React Flyknite Premium High Quality Size 37,38,39,40 IDR 699.000 . Contact Person Wa 082299464443 Line : @sev0749b . #nikereactflyknit #niketanjun #nikeairmax270… https://www.instagram.com/p/Bt5-_6PgHYD/?utm_source=ig_twitter_share&amp;igshid=3xs7r5nypo4g",,,#nikereactflyknit #niketanjun #nikeairmax270,1096417913722986496,https://twitter.com/shobur_pavel/status/1096417913722986496
2019-02-15 14:22:55,shobur_pavel,,0,0,0,"🔥Ready Stock🔥 Nike Rose Gold “Black White” Premium High Quality Size 37,38,39,40,41,42,43,44 IDR 349.000 . Contact Person Wa 082299464443 Line : @sev0749b . #nikecortez #niketanjun… https://www.instagram.com/p/Bt59ePWAj1w/?utm_source=ig_twitter_share&amp;igshid=rtqym03qo1lw",,,#nikecortez #niketanjun,1096414558200188930,https://twitter.com/shobur_pavel/status/1096414558200188930
2019-02-15 14:20:27,shobur_pavel,,0,0,0,"🔥Ready Stock🔥 Nike Tanjun “Rose Gold” Premium High Quality Size 39,40,41,42,43,44 IDR 449.000 . Contact Person Wa 082299464443 Line : @sev0749b . #nikecortez #niketanjun #nikeairmax270… https://www.instagram.com/p/Bt59MEpAvXw/?utm_source=ig_twitter_share&amp;igshid=1lwxvm5zlyh51",,,#nikecortez #niketanjun #nikeairmax270,1096413935266193408,https://twitter.com/shobur_pavel/status/1096413935266193408
2019-02-15 12:32:16,Cxmalpormayor,,0,0,0,"Nike Ebernon, Court Royale, Tanjun, Oceania, Md runner Desde 31.90€ #calzadosalpormayor https://www.calzadosalpormayor.com/es/22-nike",,,#calzadosalpormayor,1096386710701772805,https://twitter.com/Cxmalpormayor/status/1096386710701772805
2019-02-15 08:52:28,RSSDealFeeds,,0,0,0,"ad: NIKE Men's Tanjun Sneakers, Breathable Textile Uppers and Comfortable Lightweight Cushioning - https://amzn.to/2PXwauN",,,,1096331398070370304,https://twitter.com/RSSDealFeeds/status/1096331398070370304
2019-02-15 04:37:06,Georgia03248319,,0,0,0,"Nike Tanjun Women's Athletic Shoes http://bit.ly/2UUqFiH",,,,1096267131883270144,https://twitter.com/Georgia03248319/status/1096267131883270144
2019-02-15 04:35:10,Lottie60922268,,0,0,0,"Nike Tanjun Women's Athletic Shoes http://bit.ly/2UUqFiH",,,,1096266647017586688,https://twitter.com/Lottie60922268/status/1096266647017586688
2019-02-15 04:31:19,Lola89055248,,0,0,0,"Nike Tanjun Women's Athletic Shoes http://bit.ly/2UUqFiH",,,,1096265677848150016,https://twitter.com/Lola89055248/status/1096265677848150016
2019-02-15 04:26:15,Violet58289064,,0,0,0,"Nike Tanjun Women's Athletic Shoes http://bit.ly/2UUqFiH",,,,1096264400133079040,https://twitter.com/Violet58289064/status/1096264400133079040
2019-02-15 04:25:18,Elizabe61995301,,0,0,0,"Nike Tanjun Women's Athletic Shoes http://bit.ly/2UUqFiH",,,,1096264163536576515,https://twitter.com/Elizabe61995301/status/1096264163536576515
2019-02-15 04:25:09,Amber53578037,,0,0,0,"Nike Tanjun Women's Athletic Shoes http://bit.ly/2UUqFiH",,,,1096264126140170240,https://twitter.com/Amber53578037/status/1096264126140170240
2019-02-15 04:24:28,Willow33521051,,0,0,0,"Nike Tanjun Women's Athletic Shoes http://bit.ly/2UUqFiH",,,,1096263952705691650,https://twitter.com/Willow33521051/status/1096263952705691650
2019-02-15 04:24:10,tippa81,,0,0,0,"Nike Tanjun Women's Athletic Shoes http://bit.ly/2UUqFiH",,,,1096263875501133824,https://twitter.com/tippa81/status/1096263875501133824
2019-02-15 04:23:21,Sienna41251711,,0,0,0,"Nike Tanjun Women's Athletic Shoes http://bit.ly/2UUqFiH",,,,1096263670491959296,https://twitter.com/Sienna41251711/status/1096263670491959296
2019-02-15 04:23:05,Isabell45229783,,0,0,0,"Nike Tanjun Women's Athletic Shoes http://bit.ly/2UUqFiH",,,,1096263604888838144,https://twitter.com/Isabell45229783/status/1096263604888838144
2019-02-15 04:22:40,Erin95184892,,0,0,0,"Nike Tanjun Women's Athletic Shoes http://bit.ly/2UUqFiH",,,,1096263498387148802,https://twitter.com/Erin95184892/status/1096263498387148802
2019-02-15 04:22:24,Esme41967481,,0,0,0,"Nike Tanjun Women's Athletic Shoes http://bit.ly/2UUqFiH",,,,1096263432670711808,https://twitter.com/Esme41967481/status/1096263432670711808
2019-02-15 04:22:22,Avery36517159,,0,0,0,"Nike Tanjun Women's Athletic Shoes http://bit.ly/2UUqFiH",,,,1096263422914764801,https://twitter.com/Avery36517159/status/1096263422914764801
2019-02-15 04:22:16,Harper24834817,,0,0,0,"Nike Tanjun Women's Athletic Shoes http://bit.ly/2UUqFiH",,,,1096263400785674240,https://twitter.com/Harper24834817/status/1096263400785674240
2019-02-15 04:22:13,Nora38359935,,0,0,0,"Nike Tanjun Women's Athletic Shoes http://bit.ly/2UUqFiH",,,,1096263387527479298,https://twitter.com/Nora38359935/status/1096263387527479298
2019-02-15 04:22:12,Zara26283705,,0,0,0,"Nike Tanjun Women's Athletic Shoes http://bit.ly/2UUqFiH",,,,1096263381944811520,https://twitter.com/Zara26283705/status/1096263381944811520
2019-02-15 04:22:11,Leahv94631760,,0,0,0,"Nike Tanjun Women's Athletic Shoes http://bit.ly/2UUqFiH",,,,1096263376894861313,https://twitter.com/Leahv94631760/status/1096263376894861313
2019-02-15 04:22:11,Molly75562927,,0,0,0,"Nike Tanjun Women's Athletic Shoes http://bit.ly/2UUqFiH",,,,1096263375741423617,https://twitter.com/Molly75562927/status/1096263375741423617
2019-02-15 04:21:19,Eva94836506,,0,0,0,"Nike Tanjun Women's Athletic Shoes http://bit.ly/2UUqFiH",,,,1096263159751602177,https://twitter.com/Eva94836506/status/1096263159751602177
2019-02-15 04:21:18,Jasmine44298637,,0,0,0,"Nike Tanjun Women's Athletic Shoes http://bit.ly/2UUqFiH",,,,1096263154827476993,https://twitter.com/Jasmine44298637/status/1096263154827476993
2019-02-15 04:19:27,Alice25230014,,0,0,0,"Nike Tanjun Women's Athletic Shoes http://bit.ly/2UUqFiH",,,,1096262689133858817,https://twitter.com/Alice25230014/status/1096262689133858817
2019-02-15 04:18:37,Riley71595731,,0,0,0,"Nike Tanjun Women's Athletic Shoes http://bit.ly/2UUqFiH",,,,1096262479888482304,https://twitter.com/Riley71595731/status/1096262479888482304
2019-02-15 04:17:09,tippa73,,0,0,0,"Nike Tanjun Women's Athletic Shoes http://bit.ly/2UUqFiH",,,,1096262110370295808,https://twitter.com/tippa73/status/1096262110370295808
2019-02-15 04:16:28,Violet58289064,,0,0,0,"Nike Tanjun Women's Athletic Shoes http://bit.ly/2UUqFiH",,,,1096261940551319552,https://twitter.com/Violet58289064/status/1096261940551319552
2019-02-15 04:16:26,Gracie44111330,,0,0,0,"Nike Tanjun Women's Athletic Shoes http://bit.ly/2UUqFiH",,,,1096261931969712128,https://twitter.com/Gracie44111330/status/1096261931969712128
2019-02-15 04:16:26,Camila06502600,,0,0,0,"Nike Tanjun Women's Athletic Shoes http://bit.ly/2UUqFiH",,,,1096261930078142464,https://twitter.com/Camila06502600/status/1096261930078142464
2019-02-15 04:16:17,Mila19818766,,0,0,0,"Nike Tanjun Women's Athletic Shoes http://bit.ly/2UUqFiH",,,,1096261894355210241,https://twitter.com/Mila19818766/status/1096261894355210241
2019-02-15 04:16:05,Hazel61956935,,0,0,0,"Nike Tanjun Women's Athletic Shoes http://bit.ly/2UUqFiH",,,,1096261841901289472,https://twitter.com/Hazel61956935/status/1096261841901289472
2019-02-15 04:15:42,Emilia09800933,,0,0,0,"Nike Tanjun Women's Athletic Shoes http://bit.ly/2UUqFiH",,,,1096261745310609408,https://twitter.com/Emilia09800933/status/1096261745310609408
2019-02-15 04:14:33,Emmav59118998,,0,0,0,"Nike Tanjun Women's Athletic Shoes http://bit.ly/2UUqFiH",,,,1096261457791078402,https://twitter.com/Emmav59118998/status/1096261457791078402
2019-02-15 04:14:29,Lillian71647759,,0,0,0,"Nike Tanjun Women's Athletic Shoes http://bit.ly/2UUqFiH",,,,1096261439134797824,https://twitter.com/Lillian71647759/status/1096261439134797824
2019-02-15 04:14:24,Hannahv87012085,,0,0,0,"Nike Tanjun Women's Athletic Shoes http://bit.ly/2UUqFiH",,,,1096261420763754496,https://twitter.com/Hannahv87012085/status/1096261420763754496
2019-02-15 04:14:22,Hannahv87012085,,0,0,0,"Nike Tanjun Women's Athletic Shoes http://bit.ly/2UUqFiH",,,,1096261408621248513,https://twitter.com/Hannahv87012085/status/1096261408621248513
2019-02-15 04:13:15,Cathy14774221,,0,0,0,"Nike Tanjun Women's Athletic Shoes http://bit.ly/2UUqFiH",,,,1096261131365220353,https://twitter.com/Cathy14774221/status/1096261131365220353
2019-02-15 04:13:06,Tippa61,,0,0,0,"Nike Tanjun Women's Athletic Shoes http://bit.ly/2UUqFiH",,,,1096261091359948801,https://twitter.com/Tippa61/status/1096261091359948801
2019-02-15 04:12:30,Molly75562927,,0,0,0,"Nike Tanjun Women's Athletic Shoes http://bit.ly/2UUqFiH",,,,1096260941287751680,https://twitter.com/Molly75562927/status/1096260941287751680
2019-02-15 04:12:25,Nora38359935,,0,0,0,"Nike Tanjun Women's Athletic Shoes http://bit.ly/2UUqFiH",,,,1096260921171869697,https://twitter.com/Nora38359935/status/1096260921171869697
2019-02-15 04:12:24,Erin95184892,,0,0,0,"Nike Tanjun Women's Athletic Shoes http://bit.ly/2UUqFiH",,,,1096260917510238213,https://twitter.com/Erin95184892/status/1096260917510238213
2019-02-15 04:12:20,Zara26283705,,0,0,0,"Nike Tanjun Women's Athletic Shoes http://bit.ly/2UUqFiH",,,,1096260897813733377,https://twitter.com/Zara26283705/status/1096260897813733377
2019-02-15 04:12:10,Avery36517159,,0,0,0,"Nike Tanjun Women's Athletic Shoes http://bit.ly/2UUqFiH",,,,1096260857804320770,https://twitter.com/Avery36517159/status/1096260857804320770
2019-02-15 04:12:09,Harper24834817,,0,0,0,"Nike Tanjun Women's Athletic Shoes http://bit.ly/2UUqFiH",,,,1096260852796325889,https://twitter.com/Harper24834817/status/1096260852796325889
