date,username,to,replies,retweets,favorites,text,geo,mentions,hashtags,id,permalink
2019-04-27 17:05:08,TheClosetInc,,0,1,1,"Nike Tech Fleece Full-Zip Hoodie (930759) NOW $120.00 CAD WAS $150.00 CAD Nike Tech Fleece Pants (931828) NOW $95.00 CAD WAS $110.00 CAD Nike Tanjun (812655) NOW $60.00 CAD WAS $88.00 CAD Available in all store locations and online Free Canadian Shipping ",,,,1122184918409388033,https://twitter.com/TheClosetInc/status/1122184918409388033
2019-04-27 15:40:19,Picanisme,,0,0,0,"Nike Tanjun PRM Cargo Khaki Size: US 6 - US 9½ (incl.half size) 1.150 (exclude shipping) https://www.instagram.com/p/Bww6w4BgJiJDzpTTLGm8D5e6pDeXNZg7KrHPDE0/?igshid=w0ziw4sfhv1d",,,,1122163571956375552,https://twitter.com/Picanisme/status/1122163571956375552
2019-04-27 13:23:42,NPDMattPowell,,8,20,57,"Top selling athletic shoes for Q1 2019 (in dollar rank order): JORDAN VI, Nike AIR MAX 270, Nike TANJUN, JORDAN 6 RINGS, JORDAN IX MID, Nike AIR FORCE 1 LOW, Vans WARD, Adidas NMD R1, Chuck Taylor OX LOW, Nike AIR HUARACHE.",,,,1122129194304114688,https://twitter.com/NPDMattPowell/status/1122129194304114688
2019-04-27 12:54:56,lift_and_thrift,,0,0,0,"Check out NEW Nike Tanjun Racer Shoes Womens Pink Athletic Running AH5247-001 Size 7.5 https://www.ebay.com/ulk/itm/323757093096 @eBay",,@eBay,,1122121954616586240,https://twitter.com/lift_and_thrift/status/1122121954616586240
2019-04-27 11:47:21,MushyLily,,0,0,0,"https://shoppyme.com/shoes/nike-girls-tanjun-shoe-lt-atomic-pink-crimson-tint-white-size-12-kids-us/ Product Description Shaped like a running shoe with distinctive modern style, the Nike Tanjun (PS) Pre-School Girls' Shoe offers flexible, lightweight cushioning and a clean text",,,,1122104945262694400,https://twitter.com/MushyLily/status/1122104945262694400
2019-04-27 06:50:23,MushyLily,,0,0,0,"https://shoppyme.com/shoes/nike-mens-tanjun-running-sneaker-white-black-11/ Product Description Work up a sweat or complete any weekend ensemble in the easy vibes of the Nike Tanjun sneaker from Nike.. Product Features Lace-up closureBreathable fabric liningCushioned foam midsol",,,,1122030213259563013,https://twitter.com/MushyLily/status/1122030213259563013
2019-04-27 03:45:42,PetalNyeri,,0,0,0,"Check out what I just added to my closet on Poshmark: Nike Tanjun Women's Sneakers. https://poshmark.com/listing/5cbc91f29d3b7891f21b1b80?utm_campaign=referral_code%3DPETALNYERI&amp;utm_content=feature%3Dsh_li__and%26rfuid%3D5bf4d89d42633f5ea5f1dafa%26ext_trk%3Dbranch&amp;utm_source=tw_sh via @poshmarkapp #shopmycloset",,@Poshmarkapp,#shopmycloset,1121983732968120320,https://twitter.com/PetalNyeri/status/1121983732968120320
2019-04-26 21:48:24,MushyLily,,0,0,0,"https://shoppyme.com/shoes/nike-boys-tanjun-racer-gs-running-shoes-6-big-kid-m-dark-grey-white-black/ Product Description The Nike Tanjun Racer (GS) Shoe offers a mesh upper and Flywire cables for dynamic support. Product Features Flywire cables integrate with the laces for a lo",,,,1121893817353998337,https://twitter.com/MushyLily/status/1121893817353998337
2019-04-26 20:49:06,runningwatches2,,0,0,0,"Nike 818382-001 : Boy’s Tanjun PS Running Shoes Black (1.5 M US Little Kid) https://runninggear.info/nike-818382-001-boys-tanjun-ps-running-shoes-black-1-5-m-us-little-kid/",,,,1121878895475724289,https://twitter.com/runningwatches2/status/1121878895475724289
2019-04-26 02:13:07,ShamSha12057798,,0,0,0,"Nike Womens Tanjun Running Sneaker Wolf Grey/White 6 Nike https://www.amazon.com/dp/B0113OCCV6/ref=cm_sw_r_tw_dp_U_x_.BMWCbYV9HME7 via @amazon",,@amazon,,1121598046582779904,https://twitter.com/ShamSha12057798/status/1121598046582779904
2019-04-25 22:49:47,atelphobicbliss,,0,0,1,"I found some gold Nike tanjun sandals for $18 🥳",,,,1121546876283695109,https://twitter.com/atelphobicbliss/status/1121546876283695109
2019-04-25 19:33:20,Prenzi,,0,0,0,"Nike Men's Tanjun Sneakers (White/Black) - http://tinyurl.com/yyznhqgc @Prenzi",,@Prenzi,,1121497439415021568,https://twitter.com/Prenzi/status/1121497439415021568
2019-04-25 15:28:11,Mike_French1,,1,0,0,"@Nike I am a huge fan of the tanjun line of shoes but this new pair, worn 4-5 times, is already breaking down on the inside ",,@Nike,,1121435746198597640,https://twitter.com/Mike_French1/status/1121435746198597640
2019-04-25 10:24:30,collabsstorejkt,,0,0,0,"•RESTOCK• NIKE TANJUN RUN FULL WHITE Size : 36 37 38 39 40 (Incld Half Size) Sale Price : Rp 349.000 Condition : Brand New Replace Box… https://www.instagram.com/collabsstore.jkt/p/BwrNClxlUqUBJi5NPSM0bmtcKkTuhCqNorEWcY0/?utm_source=ig_twitter_share&amp;igshid=1kgeg71z83het",,,,1121359318375436288,https://twitter.com/collabsstorejkt/status/1121359318375436288
2019-04-25 05:15:18,2SpiritRanch,,0,0,0,"Nike Tanjun SE Running Shoes Gym Red/Black AR1941-003 Men's Size 9. Worn once! http://rover.ebay.com/rover/1/711-53200-19255-0/1?ff3=2&amp;toolid=10039&amp;campid=5338245860&amp;item=123745841600&amp;vectorid=229466&amp;lgeo=1",,,,1121281509003091971,https://twitter.com/2SpiritRanch/status/1121281509003091971
2019-04-25 03:22:03,Kokania3,,0,0,0,"Nike Men’s Tanjun Black/Metallic Gold/White Running Shoe 9 Men US https://kokania.com/product/nike-men-s-tanjun-black-metallic-gold-white-running-shoe-9-men-us/",,,,1121253008761937920,https://twitter.com/Kokania3/status/1121253008761937920
2019-04-25 03:19:58,Kokania3,,0,0,0,"Nike Men’s Tanjun Running Shoe, Black/Black/Anthracite 11 https://kokania.com/product/nike-men-s-tanjun-running-shoe-black-black-anthracite-11/",,,,1121252482754260992,https://twitter.com/Kokania3/status/1121252482754260992
2019-04-25 03:15:18,Kokania3,,0,0,0,"Nike Men’s Tanjun Running Sneaker Black/White 10.5 https://kokania.com/product/nike-men-s-tanjun-running-sneaker-black-white-10-5/",,,,1121251306675503104,https://twitter.com/Kokania3/status/1121251306675503104
2019-04-24 19:02:42,bandzgocrazyyy,,1,0,0,"If 45 people send me $1 on cash app I can buy the Nike Tanjun slides... $aniyamomma",,,,1121127343613865984,https://twitter.com/bandzgocrazyyy/status/1121127343613865984
2019-04-24 18:54:33,Kokania3,,0,0,0,"Nike Men’s Tanjun Black/White Running Shoe Size 11 Men US https://kokania.com/product/nike-men-s-tanjun-black-white-running-shoe-size-11-men-us/",,,,1121125288971264000,https://twitter.com/Kokania3/status/1121125288971264000
2019-04-24 17:23:53,lift_and_thrift,,0,0,0,"Check out NEW Nike Tanjun Racer Shoes Womens Pink Athletic Running AH5247-001 Size 7.5 https://www.ebay.com/ulk/itm/323757093096 @eBay",,@eBay,,1121102474746769409,https://twitter.com/lift_and_thrift/status/1121102474746769409
2019-04-24 11:54:31,lift_and_thrift,,0,0,0,"Check out NEW Nike Tanjun Racer Shoes Womens Pink Athletic Running AH5247-001 Size 7 https://www.ebay.com/ulk/itm/323755172304 @eBay",,@eBay,,1121019584180572160,https://twitter.com/lift_and_thrift/status/1121019584180572160
2019-04-23 21:08:14,ModernOwners,,0,0,0,"Nike Tanjun Racer 921669009 grey halfshoes ",,,,1120796546151452676,https://twitter.com/ModernOwners/status/1120796546151452676
2019-04-23 21:06:40,amdandemerit,,0,0,0,"Nike Womens Tanjun Running Sneaker Black/White 8 https://trade996.com/product/nike-womens-tanjun-running-sneaker-black-white-8/",,,,1120796149747736576,https://twitter.com/amdandemerit/status/1120796149747736576
2019-04-23 11:55:45,ORGNVANSHOES,,0,0,0,"#STOCKCSS NIKE TANJUN PEACH PINK/WHITE Available : 36 / 37 / 38 / 39 / 40 Rp.450.000 CONDITION : BNWB REPLACE BOX &amp; 💯 MADE INDO ORIGINALS ORDER VIA • LINE@- @ZGW3021X • LINE -… https://www.instagram.com/p/BwmN5DFjNs5/?utm_source=ig_twitter_share&amp;igshid=gl8nrzhn4s6d",,,#STOCKCSS,1120657507834265600,https://twitter.com/ORGNVANSHOES/status/1120657507834265600
2019-04-23 10:48:01,2SpiritRanch,,0,0,0,"Nike Tanjun Black Black Running Walking Shoes New In Box Men Size US 9 http://rover.ebay.com/rover/1/711-53200-19255-0/1?ff3=2&amp;toolid=10039&amp;campid=5338245860&amp;item=392282288886&amp;vectorid=229466&amp;lgeo=1",,,,1120640462124138497,https://twitter.com/2SpiritRanch/status/1120640462124138497
2019-04-23 02:04:06,Wana_B75,,0,0,0,"Check out what I just added to my closet on Poshmark: Nike Tanjun Port Wine/White sz11 812654-600. https://poshmark.com/listing/5ca553ce9d3b78b1b4a52f68?utm_campaign=referral_code%3DSND_9475&amp;utm_content=feature%3Dsh_li_el_ios%26rfuid%3D59e4ee4e0cd51fcfcddffad5%26ext_trk%3Dbranch&amp;utm_source=tw_sh via @poshmarkapp #shopmycloset",,@Poshmarkapp,#shopmycloset,1120508613687169026,https://twitter.com/Wana_B75/status/1120508613687169026
2019-04-23 02:03:28,Wana_B75,,0,0,0,"Check out what I just added to my closet on Poshmark: Nike Tanjun SE sz6.5y/sz8. https://poshmark.com/listing/5c345ce5fe515137d31cc19d?utm_campaign=referral_code%3DSND_9475&amp;utm_content=feature%3Dsh_li_el_ios%26rfuid%3D59e4ee4e0cd51fcfcddffad5%26ext_trk%3Dbranch&amp;utm_source=tw_sh via @poshmarkapp #shopmycloset",,@Poshmarkapp,#shopmycloset,1120508457231187968,https://twitter.com/Wana_B75/status/1120508457231187968
2019-04-23 00:19:21,RNZYNOW,,0,0,0,"Check out what I just added to my closet on Poshmark: NEW Nike Tanjun. https://poshmark.com/listing/5cbe35d0aa7ed3f1d9dd7cbe?utm_campaign=referral_code%3DRNZY&amp;utm_content=feature%3Dsh_li_cl_ios%26rfuid%3D59aab88a9ae22d23e906a13d%26ext_trk%3Dbranch&amp;utm_source=tw_sh via @poshmarkapp #shopmycloset",,@Poshmarkapp,#shopmycloset,1120482253107355651,https://twitter.com/RNZYNOW/status/1120482253107355651
2019-04-22 10:38:05,collabsstorejkt,,0,0,0,"*NEW ARRIVAL* NIKE TANJUN RUN PEACH ROSEGOLD Size : 36 37 38 39 40 (Incld Half Size) Sale Price : Rp 349.000 Condition : Brand New Replace Box… https://www.instagram.com/collabsstore.jkt/p/BwjgNdDFTWOQRPxH3ppE6qhTANEu0m4625iC1I0/?utm_source=ig_twitter_share&amp;igshid=1grgkos5m9gzq",,,,1120275577141977090,https://twitter.com/collabsstorejkt/status/1120275577141977090
2019-04-22 10:16:03,collabsstorejkt,,0,0,0,"*NEW ARRIVAL* NIKE TANJUN RUN PEACH SILVER Size : 36 37 38 39 40 (Incld Half Size) Sale Price : Rp 349.000 Condition : Brand New Replace Box… https://www.instagram.com/collabsstore.jkt/p/BwjdsJ0F8yZKuC78nHrXdjW0O7_tOPiv3-c-w80/?utm_source=ig_twitter_share&amp;igshid=90tzyutjx9tp",,,,1120270031449927680,https://twitter.com/collabsstorejkt/status/1120270031449927680
2019-04-22 06:59:57,collabsstorejkt,,0,0,0,"*NEW ARRIVAL* NIKE TANJUN RUN BLACK BLACK WHITE Size : 40 41 42 43 44 (Incld Half Size) Sale Price : Rp 349.000 Condition : Brand New Replace… https://www.instagram.com/collabsstore.jkt/p/BwjHPzOlXsg3IdMS0MNaynuQ8v5EIhL_37s2js0/?utm_source=ig_twitter_share&amp;igshid=uh6qhzseiew1",,,,1120220680275091456,https://twitter.com/collabsstorejkt/status/1120220680275091456
2019-04-21 18:30:45,Aust_DealFinder,,0,0,0,"Nike Tanjun Women's Athletic Shoes Just $28! (Reg. $70.00) http://dealsplus.com/Sports-and-Outdoor-Gear_deals/p_nike-tanjun-womens-athletic-shoes1",,,,1120032138211074049,https://twitter.com/Aust_DealFinder/status/1120032138211074049
2019-04-21 18:30:10,DealsPlus,,0,0,2,"Nike Tanjun Women's Athletic Shoes Just $28! (Reg. $70.00) http://dealsplus.com/Sports-and-Outdoor-Gear_deals/p_nike-tanjun-womens-athletic-shoes1",,,,1120031989447393280,https://twitter.com/DealsPlus/status/1120031989447393280
2019-04-21 15:59:27,PetalNyeri,,0,0,0,"Check out what I just added to my closet on Poshmark: Nike Tanjun Women's Sneakers. https://poshmark.com/listing/5cbc91f29d3b7891f21b1b80?utm_campaign=referral_code%3DPETALNYERI&amp;utm_content=feature%3Dsh_li_cl_and%26rfuid%3D5bf4d89d42633f5ea5f1dafa%26ext_trk%3Dbranch&amp;utm_source=tw_sh via @poshmarkapp #shopmycloset",,@Poshmarkapp,#shopmycloset,1119994062298206208,https://twitter.com/PetalNyeri/status/1119994062298206208
2019-04-21 07:06:17,HotUSDailyDeals,,0,0,0,"$24 Nike Tanjun Shoes (Reg $60) http://dealsplus.com/Women_deals/p_nike-tanjun-l-girls-shoes",,,,1119859885234163712,https://twitter.com/HotUSDailyDeals/status/1119859885234163712
2019-04-20 22:30:12,TheClosetInc,,0,0,0,"Womens Spring 2019 Collection Nike Sportswear Cropped Crew (BQ8031) $74.00 CAD Nike Tanjun (812655) WAS $88.00 CAD NOW $66.00 CAD Available in all store locations &amp; online http://ow.ly/U3Ei50r0EDh Free Canadian Shipping",,,,1119730007801253888,https://twitter.com/TheClosetInc/status/1119730007801253888
2019-04-20 22:01:36,Aust_DealFinder,,0,0,0,"$24 Nike Tanjun Shoes (Reg $60) http://dealsplus.com/Women_deals/p_nike-tanjun-l-girls-shoes",,,,1119722812695040000,https://twitter.com/Aust_DealFinder/status/1119722812695040000
2019-04-20 22:00:01,DealsPlus,,0,0,4,"$24 Nike Tanjun Shoes (Reg $60) http://dealsplus.com/Women_deals/p_nike-tanjun-l-girls-shoes",,,,1119722412403253250,https://twitter.com/DealsPlus/status/1119722412403253250
2019-04-20 18:55:19,HalfWallet,,0,0,0,"Nike Tanjun Women’s Athletic Shoes $28 @Nike @Kohls #womenfashion #womenShoe #Athletics http://bit.ly/2VcQdLO",,@Nike @Kohls,#womenfashion #womenShoe #Athletics,1119675932023848961,https://twitter.com/HalfWallet/status/1119675932023848961
2019-04-20 14:56:48,ORGNVANSHOES,,0,0,0,"#SALE 🔥 NIKE TANJUN BEIGE PEACH/WHITE Available : 36 / 37 / 38 / 39 / 40 Rp.450.000 #SALE Rp.350.000 CONDITION : BNWB REPLACE BOX &amp; 💯 MADE INDO ORIGINALS ORDER VIA • LINE@-… https://www.instagram.com/p/Bwe0OlQDaLl/?utm_source=ig_twitter_share&amp;igshid=i779ynebt3hl",,,#SALE #SALE,1119615908157243392,https://twitter.com/ORGNVANSHOES/status/1119615908157243392
2019-04-20 14:45:45,ORGNVANSHOES,,0,0,0,"#SALE 🔥 NIKE TANJUN ALL BLACK Available : 36 / 37 / 38 / 39 / 40 / 41 / 42 Rp.450.000 #SALE Rp.350.000 CONDITION : BNWB REPLACE BOX &amp; 💯 MADE INDO ORIGINALS ORDER VIA • LINE@-… https://www.instagram.com/p/Bwey9fyj3wW/?utm_source=ig_twitter_share&amp;igshid=1unafx52k4n9e",,,#SALE #SALE,1119613127232978945,https://twitter.com/ORGNVANSHOES/status/1119613127232978945
2019-04-20 14:31:32,ORGNVANSHOES,,0,0,0,"#SALE 🔥 NIKE TANJUN WMNS GREEN TOSCA/WHITE Available : 36 / 37 / 38 / 39 / 40 Rp.450.000 #SALE Rp.350.000 CONDITION : BNWB REPLACE BOX &amp; 💯 MADE INDO ORIGINALS ORDER VIA • LINE@-… https://www.instagram.com/p/BwexVXrjdIt/?utm_source=ig_twitter_share&amp;igshid=1fy6gnhoffpp5",,,#SALE #SALE,1119609547994353666,https://twitter.com/ORGNVANSHOES/status/1119609547994353666
2019-04-20 10:04:31,eDealinfoUSA,,0,0,0,"Nike Tanjun Toddler Running Shoes only $18.00 ",,,,1119542351569928192,https://twitter.com/eDealinfoUSA/status/1119542351569928192
2019-04-20 00:34:39,lift_and_thrift,,0,0,0,"Check out NEW Nike Tanjun Racer Shoes Womens Pink Athletic Running AH5247-001 Size 7 https://www.ebay.com/ulk/itm/323755172304 @eBay",,@eBay,,1119398940049276928,https://twitter.com/lift_and_thrift/status/1119398940049276928
2019-04-19 23:36:07,Trailrunningsh1,,0,0,0,"NIKE Mens Tanjun SE Cool Grey/Cool Grey-Black Size 9 Review https://nicefitness.info/nike-mens-tanjun-se-cool-grey-cool-grey-black-size-9-review/",,,,1119384209242710016,https://twitter.com/Trailrunningsh1/status/1119384209242710016
2019-04-19 17:55:38,ModernOwners,,0,0,0,"Nike Mens Tanjun SE Low Top Lace Up Running, White-blue-navy Blue, Size 11.0 http://rover.ebay.com/rover/1/711-53200-19255-0/1?ff3=2&amp;toolid=10039&amp;campid=5338247320&amp;item=163657044355&amp;vectorid=229466&amp;lgeo=1",,,,1119298525211299841,https://twitter.com/ModernOwners/status/1119298525211299841
2019-04-19 17:43:17,SherryRochford,,0,0,0,"Check out what I just added to my closet on Poshmark: NIKE WOMENS TANJUN SNEAKERS- BABY BLUE SZ 7💥NIKE!. https://poshmark.com/listing/5c97e531534ef9a9638f23ae?utm_campaign=referral_code%3DSHERDEN1205&amp;utm_content=feature%3Dsh_li_el_ios%26rfuid%3D5c60ed728a9b5a392ecee94a%26ext_trk%3Dbranch&amp;utm_source=tw_sh via @poshmarkapp #shopmycloset",,@Poshmarkapp,#shopmycloset,1119295415927447552,https://twitter.com/SherryRochford/status/1119295415927447552
2019-04-19 16:34:54,belledemuse,,0,0,0,"I just discovered this on Poshmark: Nike Tanjun White/ Metallic Silver Size 8.5. https://posh.mk/p619XSUc1V via @poshmarkapp",,@Poshmarkapp,,1119278206580736001,https://twitter.com/belledemuse/status/1119278206580736001
2019-04-19 16:07:33,Wana_B75,,0,0,0,"Check out what I just added to my closet on Poshmark: Nike Tanjun Port Wine/White sz11 812654-600. https://poshmark.com/listing/5ca553ce9d3b78b1b4a52f68?utm_campaign=referral_code%3DSND_9475&amp;utm_content=feature%3Dsh_li_el_ios%26rfuid%3D59e4ee4e0cd51fcfcddffad5%26ext_trk%3Dbranch&amp;utm_source=tw_sh via @poshmarkapp #shopmycloset",,@Poshmarkapp,#shopmycloset,1119271326529638401,https://twitter.com/Wana_B75/status/1119271326529638401
2019-04-19 16:06:55,Wana_B75,,0,0,0,"Check out what I just added to my closet on Poshmark: Nike Tanjun SE sz6.5y/sz8. https://poshmark.com/listing/5c345ce5fe515137d31cc19d?utm_campaign=referral_code%3DSND_9475&amp;utm_content=feature%3Dsh_li_el_ios%26rfuid%3D59e4ee4e0cd51fcfcddffad5%26ext_trk%3Dbranch&amp;utm_source=tw_sh via @poshmarkapp #shopmycloset",,@Poshmarkapp,#shopmycloset,1119271165699051520,https://twitter.com/Wana_B75/status/1119271165699051520
2019-04-19 06:50:02,JustBlingItinc,,0,0,0,"Girls Nike Tanjun Blinged Out With Swarovski Crystals - Triple Black - Big Kids #blingbling #crystal http://www.justblingitinc.com/148-girls-nike-tanjun-crystals-triple-black-big-kids.html",,,#blingbling #crystal,1119131019360129025,https://twitter.com/JustBlingItinc/status/1119131019360129025
2019-04-18 19:24:11,Jrd117,,0,0,2,"Nike Tanjun Trainers Mens White Athletic Sneakers Shoes - https://buyaussiestuff.com/nike-tanjun-trainers-mens-white-athletic-sneakers-shoes/",,,,1118958421145837573,https://twitter.com/Jrd117/status/1118958421145837573
2019-04-18 18:21:50,camjohnssposhm1,,0,0,0,"I just discovered this on Poshmark: NEW Nike Tanjun. https://posh.mk/yjEpzEEFZV via @poshmarkapp",,@Poshmarkapp,,1118942730485260288,https://twitter.com/camjohnssposhm1/status/1118942730485260288
2019-04-18 14:41:31,poshitivelymad,,0,0,0,"I just discovered this on Poshmark: Red White & Blue Nike Tanjun Sneakers. https://posh.mk/32cxFtUpZV via @poshmarkapp",,@Poshmarkapp,,1118887285762744320,https://twitter.com/poshitivelymad/status/1118887285762744320
2019-04-18 11:37:09,EtSpecialcloth,,0,1,1,"Nike Take tanjun Black gold swoosh going at K26,000. Size 6UK 7US ",,,,1118840888107720704,https://twitter.com/EtSpecialcloth/status/1118840888107720704
2019-04-18 10:58:15,ChantelGardnerx,,1,0,0,"@Nike why don't you sell your Tanjun sandals in the UK? I'd love to buy a pair but cannot find any site that will ship to the UK:(",,@Nike,,1118831100783202304,https://twitter.com/ChantelGardnerx/status/1118831100783202304
2019-04-18 00:04:35,tbcaleb76,,0,0,0,"Check out what I just added to my closet on Poshmark: Nike Tanjun Shoes. https://poshmark.com/listing/5ca7df986a7fba6f4b2625ee?utm_campaign=referral_code%3DTBCALEB&amp;utm_content=feature%3Dsh_li_el_ios%26rfuid%3D5c579ef21e2d2d5d59a0700e%26ext_trk%3Dbranch&amp;utm_source=tw_sh via @poshmarkapp #shopmycloset",,@Poshmarkapp,#shopmycloset,1118666596208144386,https://twitter.com/tbcaleb76/status/1118666596208144386
2019-04-17 15:10:42,offerta_sport,,0,0,0,"NIKE Tanjun (GS), Scarpe da Fitness Bambino, (Blue Void/Metallic Gold/White 406), 38 EU 🔥 Ora: 43.79€ | Prima: 49.50€ 📊 Prezzo medio 30gg: 46.09€ Link: https://amzn.to/2QTxQt4 #NIKE #Scarpe",,,#NIKE #Scarpe,1118532241766928385,https://twitter.com/offerta_sport/status/1118532241766928385
2019-04-17 07:08:15,ilmostrodiyt,,0,0,0,"Per due soldi Nike Wmns Tanjun, Scarpe Running Donna https://amzn.to/2KMQktx PREZZO SCONTATO: 65,99€ http://bit.ly/2v7LyvV http://bit.ly/2OXYKNb",,,,1118410828628336640,https://twitter.com/ilmostrodiyt/status/1118410828628336640
2019-04-17 07:00:03,JustBlingItinc,,0,0,0,"Girls Nike Tanjun Blinged Out With Swarovski Crystals - Triple Black - Big Kids #blingbling #crystal http://www.justblingitinc.com/148-girls-nike-tanjun-crystals-triple-black-big-kids.html",,,#blingbling #crystal,1118408767068966912,https://twitter.com/JustBlingItinc/status/1118408767068966912
2019-04-17 06:54:48,ilmostrodiyt,,0,0,0,"Per due soldi Nike Wmns Tanjun, Scarpe Running Donna https://amzn.to/2KMQktx PREZZO SCONTATO: 65,99€ https://t.me/DuesoldisuAmazon/1182",,,,1118407443372019712,https://twitter.com/ilmostrodiyt/status/1118407443372019712
2019-04-17 01:08:05,dbrixx24,Seaneff,1,0,0,"No different one is Nike free runs and the other are Nike tanjun’s",,,,1118320192436748290,https://twitter.com/dbrixx24/status/1118320192436748290
2019-04-16 22:31:47,Velociraptor_8,Velociraptor_8,0,0,1,"More specifically Adidas Gazelle and Nikes Tanjun 👍🏻",,,,1118280856706195457,https://twitter.com/Velociraptor_8/status/1118280856706195457
2019-04-16 19:36:37,WearItForLess,,0,0,0,"Nike: Tanjun Sneakers – only $40 Shipped! https://www.wearitforless.com/2019/04/nike-tanjun-sneakers-only-40-shipped/",,,,1118236772725592076,https://twitter.com/WearItForLess/status/1118236772725592076
2019-04-16 14:13:18,TheShoeShop2,,0,0,0,"Nike Women’s Tanjun Running Shoes http://www.theshoesshop.co.uk/nike-womens-tanjun-running-shoes/",,,,1118155409007828993,https://twitter.com/TheShoeShop2/status/1118155409007828993
2019-04-16 02:15:54,tbcaleb76,,0,0,0,"Check out what I just added to my closet on Poshmark: Nike Tanjun Shoes. https://poshmark.com/listing/5ca7df986a7fba6f4b2625ee?utm_campaign=referral_code%3DTBCALEB&amp;utm_content=feature%3Dsh_li_el_ios%26rfuid%3D5c579ef21e2d2d5d59a0700e%26ext_trk%3Dbranch&amp;utm_source=tw_sh via @poshmarkapp #shopmycloset",,@Poshmarkapp,#shopmycloset,1117974869973422080,https://twitter.com/tbcaleb76/status/1117974869973422080
2019-04-16 01:05:21,rubixresale,,0,0,0,"Check out what I just added to my closet on Poshmark: Blue and white Nike Tanjun running shoes size 7. https://poshmark.com/listing/5c8e6cc1409c1548f71f7b88?utm_campaign=referral_code%3DANDREALEGGETT&amp;utm_content=feature%3Dsh_li__and%26rfuid%3D55f63f7540b19eb37f1c4b6b%26ext_trk%3Dbranch&amp;utm_source=tw_sh via @poshmarkapp #shopmycloset",,@Poshmarkapp,#shopmycloset,1117957113601380353,https://twitter.com/rubixresale/status/1117957113601380353
2019-04-15 21:05:07,loookatmeimkiad,,0,0,20,"I ordered them online from shoe carnival but I'm sure u can get any anywhere else! I live in PR so that's the only place I found that can ship to me! theyre called nike tanjun sandals!",,,,1117896656198856704,https://twitter.com/loookatmeimkiad/status/1117896656198856704
2019-04-15 18:02:51,SherryRochford,,0,0,0,"Check out what I just added to my closet on Poshmark: NIKE WOMENS TANJUN SNEAKERS- BABY BLUE SZ 7💥NIKE!. https://poshmark.com/listing/5c97e531534ef9a9638f23ae?utm_campaign=referral_code%3DSHERDEN1205&amp;utm_content=feature%3Dsh_li_el_ios%26rfuid%3D5c60ed728a9b5a392ecee94a%26ext_trk%3Dbranch&amp;utm_source=tw_sh via @poshmarkapp #shopmycloset",,@Poshmarkapp,#shopmycloset,1117850789714616324,https://twitter.com/SherryRochford/status/1117850789714616324
2019-04-15 16:29:36,lawrence33180,,0,0,0,"$43.99 Nike Tanjun SE Running Shoes Gym Red Black White AR1941-003 Men’s Size 9.5 https://www.ebay.com/ulk/itm/303108538967 ⁦@eBay⁩",,@eBay,,1117827321170472962,https://twitter.com/lawrence33180/status/1117827321170472962
2019-04-15 14:32:27,yeahbuddy1269,,0,0,0,"💋Nike Tanjun Sneaker-Glacier Blue https://posh.mk/YkXO6VwqUV",,,,1117797838690430976,https://twitter.com/yeahbuddy1269/status/1117797838690430976
2019-04-15 14:23:47,MwestCoupCliper,,0,0,0,"🔥 RED HOT! 🔥 Big &amp; Little Kids Nike Tanjun - Assorted Colors as low as $30 &amp; FREE SHIPPING!!!! Here ➔ ➔ ",,,,1117795659552309248,https://twitter.com/MwestCoupCliper/status/1117795659552309248
2019-04-14 18:48:00,Jrd117,,0,0,0,"Nike Tanjun Training Shoes Mens White/White Sports Fitness Trainers... - https://buyaussiestuff.com/nike-tanjun-training-shoes-mens-white-white-sports-fitness-trainers/",,,,1117499763753013249,https://twitter.com/Jrd117/status/1117499763753013249
2019-04-14 17:47:09,CoreParkour,,0,0,0,"Nike Tanjun triple black run free running shoes referee training marathon 10 men http://tracklix.com/bwh5",,,,1117484450567327750,https://twitter.com/CoreParkour/status/1117484450567327750
2019-04-14 14:48:11,RNZYNOW,,0,0,0,"Check out what I just added to my closet on Poshmark: NEW Nike Tanjun Racer. https://poshmark.com/listing/5cb3475bd1aa258928c85669?utm_campaign=referral_code%3DRNZY&amp;utm_content=feature%3Dsh_li_cl_ios%26rfuid%3D59aab88a9ae22d23e906a13d%26ext_trk%3Dbranch&amp;utm_source=tw_sh via @poshmarkapp #shopmycloset",,@Poshmarkapp,#shopmycloset,1117439412239908865,https://twitter.com/RNZYNOW/status/1117439412239908865
2019-04-14 08:30:43,ijurisc,,0,0,0,"Check out Nike Tanjun SE Sports Shoes Sneakers Trainers - All Colors And Sizes #Nike #RunningShoes https://ebay.us/UDmv6R via @eBay",,@eBay,#Nike #RunningShoes,1117344420108611584,https://twitter.com/ijurisc/status/1117344420108611584
2019-04-14 06:40:04,JustBlingItinc,,0,0,0,"Nike Tanjun Racer Blinged Out With Swarovski Crystals - Blue #blingbling #crystal http://www.justblingitinc.com/23-nike-tanjun-racer-crystals-blue.html",,,#blingbling #crystal,1117316574099066880,https://twitter.com/JustBlingItinc/status/1117316574099066880
2019-04-13 21:32:09,GolfClubDeals1,,0,0,0,"NIKE Tanjun Black+White Women’s Running Shoes Athletic Sneakers 812655 New https://golfclubdailydeals.com/index.php/2019/04/13/nike-tanjun-blackwhite-womens-running-shoes-athletic-sneakers-812655-new/",,,,1117178686640414722,https://twitter.com/GolfClubDeals1/status/1117178686640414722
2019-04-13 14:14:38,ijurisc,,0,0,0,"Check out Nike Tanjun SE Sports Shoes Sneakers Trainers - All Colors And Sizes #Nike #RunningShoes https://ebay.us/UDmv6R via @eBay",,@eBay,#Nike #RunningShoes,1117068579407577093,https://twitter.com/ijurisc/status/1117068579407577093
